,description,edam_topics,help,id,inputs,name,outputs
775,Add annotations from dbNSFP or similar annotation DBs,, The dbNSFP is an integrated database of functional predictions from multiple algorithms  SIFT  Polyphen2  LRT and MutationTaster  PhyloP and GERP    etc    It contains variant annotations such as   1000Gp1 AC     Alternative allele counts in the whole 1000 genomes phase 1  1000Gp1  data 1000Gp1 AF     Alternative allele frequency in the whole 1000Gp1 data 1000Gp1 AFR AC     Alternative allele counts in the 1000Gp1 African descendent samples 1000Gp1 AFR AF     Alternative allele frequency in the 1000Gp1 African descendent samples 1000Gp1 AMR AC     Alternative allele counts in the 1000Gp1 American descendent samples 1000Gp1 AMR AF     Alternative allele frequency in the 1000Gp1 American descendent samples 1000Gp1 ASN AC     Alternative allele counts in the 1000Gp1 Asian descendent samples 1000Gp1 ASN AF     Alternative allele frequency in the 1000Gp1 Asian descendent samples 1000Gp1 EUR AC     Alternative allele counts in the 1000Gp1 European descendent samples 1000Gp1 EUR AF     Alternative allele frequency in the 1000Gp1 European descendent samples aaalt     Alternative amino acid      if the variant is a splicing site SNP  2bp on each end of an intron  aapos     Amino acid position as to the protein    1  if the variant is a splicing site SNP  2bp on each end of an intron  aapos SIFT     ENSP id and amino acid positions corresponding to SIFT scores  Multiple entries separated by     aapos FATHMM     ENSP id and amino acid positions corresponding to FATHMM scores  Multiple entries separated by     aaref     Reference amino acid      if the variant is a splicing site SNP  2bp on each end of an intron  alt     Alternative nucleotide allele  as on the   strand  Ancestral allele     Ancestral allele  based on 1000 genomes reference data  cds strand     Coding sequence  CDS  strand    or    chr     Chromosome number codonpos     Position on the codon  1  2 or 3  Ensembl geneid     Ensembl gene ID Ensembl transcriptid     Ensembl transcript IDs  separated by      ESP6500 AA AF     Alternative allele frequency in the African American samples of the NHLBI GO Exome Sequencing Project  ESP6500 data set  ESP6500 EA AF     Alternative allele frequency in the European American samples of the NHLBI GO Exome Sequencing Project  ESP6500 data set  FATHMM pred     If a FATHMM score is    1 5  or rankscore   0 81415  the corresponding non synonymous SNP is predicted as  D AMAGING    otherwise it is predicted as  T OLERATED    Multiple predictions separated by     FATHMM rankscore     FATHMMori scores were ranked among all FATHMMori scores in dbNSFP  The rankscore is the ratio of the rank of the score over the total number of FATHMMori scores in dbNSFP  If there are multiple scores  only the most damaging  largest  rankscore is presented  The scores range from 0 to 1 FATHMM score     FATHMM default score  FATHMMori  fold degenerate     Degenerate type  0  2 or 3  genename     Gene name  if the non synonymous SNP can be assigned to multiple genes  gene names are separated by     GERP   NR     GERP   neutral rate GERP   RS     GERP   RS score  the larger the score  the more conserved the site GERP   RS rankscore     GERP   RS scores were ranked among all GERP   RS scores in dbNSFP  The rankscore is the ratio of the rank of the score over the total number of GERP   RS scores in dbNSFP hg18 pos 1 coor      Physical position on the chromosome as to hg18  1 based coordinate  Interpro domain     Domain or conserved site on which the variant locates LR pred     Prediction of our LR based ensemble prediction score   T olerated   or  D amaging    The score cutoff between  D  and  T  is 0 5  The rankscore cutoff between  D  and  T  is 0 82268 LR rankscore     LR scores were ranked among all LR scores in dbNSFP  The rankscore is the ratio of the rank of the score over the total number of LR scores in dbNSFP  The scores range from 0 to 1 LR score     Our logistic regression  LR  based ensemble prediction score  which incorporated 10 scores  SIFT  PolyPhen 2 HDIV  PolyPhen 2 HVAR  GERP    MutationTaster  Mutation Assessor  FATHMM  LRT  SiPhy  PhyloP  and the maximum frequency observed in the 1000 genomes populations  Larger value means the SNV is more likely to be damaging  Scores range from 0 to 1 LRT Omega     Estimated nonsynonymous to synonymous rate ratio  Omega  reported by LRT  LRT converted rankscore     LRTori scores were first converted as LRTnew 1 LRTori 0 5 if Omega 1  or LRTnew LRTori 0 5 if Omega  1  Then LRTnew scores were ranked among all LRTnew scores in dbNSFP  The rankscore is the ratio of the rank over the total number of the scores in dbNSFP  The scores range from 0 00166 to 0 85682 LRT pred     LRT prediction  D eleterious   N eutral  or U nknown   which is not solely determined by the score LRT score     The original LRT two sided p value  LRTori   ranges from 0 to 1 MutationAssessor pred     MutationAssessor s functional impact of a variant MutationAssessor rankscore     MAori scores were ranked among all MAori scores in dbNSFP  The rankscore is the ratio of the rank of the score over the total number of MAori scores in dbNSFP  The scores range from 0 to 1 MutationAssessor score     MutationAssessor functional impact combined score  MAori  MutationTaster converted rankscore     The MTori scores were first converted  if the prediction is  A  or  D  MTnew MTori  if the prediction is  N  or  P   MTnew 1 MTori  Then MTnew scores were ranked among all MTnew scores in dbNSFP  The rankscore is the ratio of the rank of the score over the total number of MTnew scores in dbNSFP  The scores range from 0 0931 to 0 80722 MutationTaster pred     MutationTaster prediction MutationTaster score     MutationTaster p value  MTori   ranges from 0 to 1 phastCons46way placental     phastCons conservation score based on the multiple alignments of 33 placental mammal genomes  including human   The larger the score  the more conserved the site phastCons46way placental rankscore     phastCons46way placental scores were ranked among all phastCons46way placental scores in dbNSFP  The rankscore is the ratio of the rank of the score over the total number of phastCons46way placental scores in dbNSFP phastCons46way primate     phastCons conservation score based on the multiple alignments of 10 primate genomes  including human   The larger the score  the more conserved the site phastCons46way primate rankscore     phastCons46way primate scores were ranked among all phastCons46way primate scores in dbNSFP  The rankscore is the ratio of the rank of the score over the total number of phastCons46way primate scores in dbNSFP phastCons100way vertebrate     phastCons conservation score based on the multiple alignments of 100 vertebrate genomes  including human   The larger the score  the more conserved the site phastCons100way vertebrate rankscore     phastCons100way vertebrate scores were ranked among all phastCons100way vertebrate scores in dbNSFP  The rankscore is the ratio of the rank of the score over the total number of phastCons100way vertebrate scores in dbNSFP phyloP46way placental     phyloP  phylogenetic p values  conservation score based on the multiple alignments of 33 placental mammal genomes  including human   The larger the score  the more conserved the site phyloP46way placental rankscore     phyloP46way placental scores were ranked among all phyloP46way placental scores in dbNSFP  The rankscore is the ratio of the rank of the score over the total number of phyloP46way placental scores in dbNSFP phyloP46way primate     phyloP  phylogenetic p values  conservation score based on the multiple alignments of 10 primate genomes  including human   The larger the score  the more conserved the site phyloP46way primate rankscore     phyloP46way primate scores were ranked among all phyloP46way primate scores in dbNSFP  The rankscore is the ratio of the rank of the score over the total number of phyloP46way primate scores in dbNSFP phyloP100way vertebrate     phyloP  phylogenetic p values  conservation score based on the multiple alignments of 100 vertebrate genomes  including human   The larger the score  the more conserved the site phyloP100way vertebrate rankscore     phyloP100way vertebrate scores were ranked among all phyloP100way vertebrate scores in dbNSFP  The rankscore is the ratio of the rank of the score over the total number of phyloP100way vertebrate scores in dbNSFP Polyphen2 HDIV pred     Polyphen2 prediction based on HumDiv Polyphen2 HDIV rankscore     Polyphen2 HDIV scores were first ranked among all HDIV scores in dbNSFP  The rankscore is the ratio of the rank the score over the total number of the scores in dbNSFP  If there are multiple scores  only the most damaging  largest  rankscore is presented  The scores range from 0 02656 to 0 89917 Polyphen2 HDIV score     Polyphen2 score based on HumDiv  i e  hdiv prob  The score ranges from 0 to 1  Multiple entries separated by     Polyphen2 HVAR pred     Polyphen2 prediction based on HumVar Polyphen2 HVAR rankscore     Polyphen2 HVAR scores were first ranked among all HVAR scores in dbNSFP  The rankscore is the ratio of the rank the score over the total number of the scores in dbNSFP  If there are multiple scores  only the most damaging  largest  rankscore is presented  The scores range from 0 01281 to 0 9711 Polyphen2 HVAR score     Polyphen2 score based on HumVar  i e  hvar prob  The score ranges from 0 to 1  Multiple entries separated by     pos 1 coor      Physical position on the chromosome as to hg19  1 based coordinate  RadialSVM pred     Prediction of our SVM based ensemble prediction score   T olerated   or  D amaging    The score cutoff between  D  and  T  is 0  The rankscore cutoff between  D  and  T  is 0 83357 RadialSVM rankscore     RadialSVM scores were ranked among all RadialSVM scores in dbNSFP  The rankscore is the ratio of the rank of the screo over the total number of RadialSVM scores in dbNSFP  The scores range from 0 to 1 RadialSVM score     Our support vector machine  SVM  based ensemble prediction score  which incorporated 10 scores  SIFT  PolyPhen 2 HDIV  PolyPhen 2 HVAR  GERP    MutationTaster  Mutation Assessor  FATHMM  LRT  SiPhy  PhyloP  and the maximum frequency observed in the 1000 genomes populations  Larger value means the SNV is more likely to be damaging  Scores range from  2 to 3 in dbNSFP ref     Reference nucleotide allele  as on the   strand  refcodon     Reference codon Reliability index     Number of observed component scores  except the maximum frequency in the 1000 genomes populations  for RadialSVM and LR  Ranges from 1 to 10  As RadialSVM and LR scores are calculated based on imputed data  the less missing component scores  the higher the reliability of the scores and predictions SIFT converted rankscore     SIFTori scores were first converted to SIFTnew 1 SIFTori  then ranked among all SIFTnew scores in dbNSFP  The rankscore is the ratio of the rank the SIFTnew score over the total number of SIFTnew scores in dbNSFP  If there are multiple scores  only the most damaging  largest  rankscore is presented  The rankscores range from 0 02654 to 0 87932 SIFT pred     If SIFTori is smaller than 0 05  rankscore 0 55  the corresponding non synonymous SNP is predicted as  D amaging    otherwise it is predicted as  T olerated    Multiple predictions separated by     SIFT score     SIFT score  SIFTori   Scores range from 0 to 1  The smaller the score the more likely the SNP has damaging effect  Multiple scores separated by     SiPhy 29way logOdds     SiPhy score based on 29 mammals genomes  The larger the score  the more conserved the site SiPhy 29way pi     The estimated stationary distribution of A  C  G and T at the site  using SiPhy algorithm based on 29 mammals genomes SLR test statistic     SLR test statistic for testing natural selection on codons  A negative value indicates negative selection  and a positive value indicates positive selection  Larger magnitude of the value suggests stronger evidence Uniprot aapos     Amino acid position as to Uniprot  Multiple entries separated by     Uniprot acc     Uniprot accession number  Multiple entries separated by     Uniprot id     Uniprot ID number  Multiple entries separated by     UniSNP ids     rs numbers from UniSNP  which is a cleaned version of dbSNP build 129  in format  rs number1 rs number2      The dbNSFP database is available from  and there is only annotation for human genome builds   The procedure for preparing the dbNSFP data for use in SnpSift dbnsfp and a couple of prebuilt dbNSFP databases are available at   dbNSFP  However  any dbNSFP like tabular file that be can used with SnpSift dbnsfp if it has     The first line of the file must be column headers that name the annotations    The first 4 columns are required and must be     1  chr  chromosome   2  pos 1 coor   position in chromosome   3  ref  reference base   4  alt  alternate base  For example         chr pos 1 coor  ref alt aaref aaalt genename SIFT score     1 69134 A C E A OR4F5 0 03     1 69134 A G E G OR4F5 0 09     1 69134 A T E V OR4F5 0 03     4 100239319 T A H L ADH1B 0     4 100239319 T C H R ADH1B 0 15     4 100239319 T G H P ADH1B 0  The Galaxy datatypes for dbNSFP can automatically convert the specially formatted tabular file for use by SnpSift dbNSFP   1  Upload the tabular file  set the datatype as     dbnsfp tabular    2  Edit the history dataset attributes  pencil icon   Use  Convert Format  to convert the    dbnsfp tabular    to the correct format for SnpSift dbnsfp     snpsiftdbnsfp       EXTERNAL DOCUMENTATION     dbNSFP     ,snpSift_dbnsfp,"vcf,snpsiftdbnsfp",SnpSift dbNSFP,vcf
776,"Annotating GeneSets, such as Gene Ontology, KEGG, Reactome",, This tool uses  SnpSift GeneSets   to add annotations from  MSigDB    a collection of annotated gene sets from different sources including Gene Ontology  GO   KEGG  Reactome       SnpSift GeneSets   geneSets     class   warningmark  The input VCF file must be annotated using SnpEff before performing GeneSets annotations  This is because the tool must know which gene the variant affects    EXTERNAL DOCUMENTATION       MSigDB       ,snpSift_geneSets,"vcf,txt",SnpSift GeneSets,"vcf,txt"
777,Convert VCF data into TAB-delimited format,, Converts VCF dataset to tab delimited format  using null string to replace empty values in the table  Specifying    Report data per sample      g  will output one line per sample with genotype information         Vcf2Tsv  IS PART OF VCFLIB    ,vcf2tsv,vcf,VCFtoTab-delimited:,tabular
778,Adds info fields from the second dataset which are not present in the first dataset,,  Adds info fields from the second dataset which are not present in the first dataset          Vcfaddinfo  IS PART OF VCFLIB  ,vcfaddinfo,vcf,VCFaddinfo:,vcf
779,Split alleleic primitives (gaps or mismatches) into multiple VCF lines,,  If multiple alleleic primitives  gaps or mismatches  are specified in a single VCF record  this tools splits the record into multiple lines  but drops all INFO fields     Pure  MNPs are split into multiple SNPs unless the  m flag is provided   Genotypes are phased where complex alleles have been decomposed  provided genotypes in the input   The options are         m    use mnps          Retain MNPs as separate events  default  false        t    tag parsed FLAG   Tag records which are split apart of a complex allele with this flag       L    max length LEN    Do not manipulate records in which either the ALT or                             REF is longer than LEN  default  200        k    keep info         Maintain site and allele level annotations when decomposing                              Note that in many cases  such as multisample VCFs  these won t                             be valid post decomposition   For biallelic loci in single sample                             VCFs  they should be usable with caution       g    keep geno         Maintain genotype level annotations when decomposing   Similar                             caution should be used for this as for   keep info         Vcfallelicprimitives  IS PART OF VCFLIB      ,vcfallelicprimitives,vcf,VcfAllelicPrimitives:,vcf
780,Intersect VCF records with BED annotations,,  Intersect the records in the VCF file with intervals  features  provided in a BED file  Intersections are done on the reference sequences in the VCF file              class   infomark     Example     The following VCF line      CHROM POS     ID        REF ALT QUAL FILTER INFO                              FORMAT      NA00001        NA00002      NA00003  20     1110696 rs6040355 A   G T 67   PASS   NS 2 DP 10 AF 0 333 0 667 AA T DB GT GQ DP HQ 1 2 21 6 23 27 2 1 2 0 18 2 2 2 35 4      will appear as the follwing after intersectuion with BED records uc010zpo 2  uc002wel 4  uc010zpp 2  and uc002wen      CHROM POS     ID        REF ALT QUAL FILTER INFO                                                                                       FORMAT      NA00001        NA00002      NA00003                                                    20     1110696 rs6040355 A   G T 67   PASS   AA T AF 0 333 0 667 BED features uc010zpo 2 uc002wel 4 uc010zpp 2 uc002wen 4 DP 10 NS 2 DB GT GQ DP HQ 1 2 21 6 23 27 2 1 2 0 18 2 2 2 35 4            Vcfannotate  IS PART OF VCFLIB      ,vcfannotate,"vcf,bed",VCFannotate:,vcf
781,Annotate genotypes in a VCF dataset using genotypes from another VCF dataset,,  Annotates genotypes in the   First   dataset with genotypes from the   Second   adding the genotype as another flag to each sample filled in the first file    Annotation tag   is the name of the sample flag which is added to store the annotation   Also adds a  has  variant  flag for sites where the second file has a variant          Vcfannotate  IS PART OF VCFLIB  ,vcfannotategenotypes,vcf,VCFannotateGenotypes:,vcf
782,Intersect VCF and BED datasets,, Computes intersection between a VCF dataset and a set of genomic intervals defined as either a BED dataset   format1  or a manually typed interval  in the form of chr start end          VCFBEDintersect is based on vcfintersect utility of VCFlib toolkit developed by Erik Garrison       ,vcfbedintersect,"vcf,bed",VCF-BEDintersect:,vcf
783,"Break multiple alleles into multiple records, or combine overallpoing alleles into a single record",, This tool breaks or creates multiallelic VCF records based on user selection    Break   or   Create    respectively         Break     If multiple alleles are specified in a single record  break the record into multiple lines  preserving allele specific INFO fields       Create     If overlapping alleles are represented across multiple records  merge them into a single record         This tools is based on vcfbreakmulti and vcfcreatemulti utilities from the VCFlib toolkit developed by Erik Garrison       ,vcfbreakcreatemulti,vcf,VCFbreakCreateMulti:,vcf
784,Verify that the reference allele matches the reference genome,,  Verifies that the VCF REF field matches the reference as described     The options are         x    exclude failures If a record fails  don t print it   Otherwise do       k    keep failures    Print if the record fails  otherwise not         Vcfcheck  IS PART OF VCFLIB      ,vcfcheck,"vcf,fasta",VCFcheck:,vcf
785,Combine multiple VCF datasets,,  Combines VCF files positionally  combining samples when sites and alleles are identical  Any number of VCF files may be combined  The INFO field and other columns are taken from one of the files  which are combined when records in multiple files match  Alleles must have identical ordering to be combined into one record  If they do not  multiple records will be emitted          Vcfcombine  IS PART OF VCFLIB      ,vcfcombine,vcf,VCFcombine:,vcf
786,Output records belonging to samples common between two datasets,,    ,vcfcommonsamples,vcf,VCFcommonSamples:,vcf
787,Calculate distance to the nearest variant,,  Adds a value to each VCF record indicating the distance to the nearest variant in the file      class   infomark  The dataset used as input to this tool must be coordinate sorted  This can be achieved by either using the VCFsort utility or Galaxy s general purpose sort tool  in this case sort on the first and the second column in ascending order          Vcfdistance  IS PART OF VCFLIB  ,vcfdistance,vcf,VCFdistance:,vcf
788,filter VCF data in a variety of attributes,, You can specify the following options within the   Specify filtering expression   box in any combination         f    info filter     specifies a filter to apply to the info fields of records  removes alleles which do not pass the filter      g    genotype filter specifies a filter to apply to the genotype fields of records      s    filter sites    filter entire records  not just alleles      t    tag pass        tag vcf records as positively filtered with this tag  print all records      F    tag fail        tag vcf records as negatively filtered with this tag  print all records      A    append filter   append the existing filter tag  don t just replace it      a    allele tag      apply  t on a per allele basis   adds or sets the corresponding INFO field tag      v    invert          inverts the filter  e g  grep  v      o    or              use logical OR instead of AND to combine filters      r    region          specify a region on which to target the filtering  must be used in conjunction with  f or  g   Filters are specified in the form  ID   operator   value       f  DP   10             for info fields   g  GT   1 1            for genotype fields   f  CpG                 for  flag  fields  Any number of filters may be specified   They are combined via logical AND unless the   or option is specified  For convenience  you can specify  QUAL  to refer to the quality of the site  even though it does not appear in the INFO fields   Operators can be any of              pipe      To restrict output to a specific location use the  r option  must be used in conjunction with  g or  f       r chr20 14000 15000    only output calls between positions 14 000 and 15 000 on chromosome 20   r chrX                 only output call on chromosome X         Vcffilter  IS PART OF VCFLIB      ,vcffilter2,vcf,VCFfilter:,vcf
789,Count the allele frequencies across alleles present in each record in the VCF file,,  Uses genotypes from the selected VCF dataset to correct AC  alternate allele count   AF  alternate allele frequency   NS  number of called   in the VCF records         Vcffixup  IS PART OF VCFLIB  ,vcffixup,vcf,VCFfixup:,vcf
790,Removes multi-allelic sites by picking the most common alternate,,  Removes multi allelic sites by picking the most common alternate   Requires allele frequency specification  AF  and use of  G  and  A  to specify the fields which vary according to the Allele or Genotype         Vcfflatten  IS PART OF VCFLIB  ,vcfflatten2,vcf,VCFflatten:,vcf
791,Convert genotype-based phased alleles into haplotype alleles,,  Convert genotype based phased alleles within a window size specified by  w option into haplotype alleles  Will break haplotype construction when encountering non phased genotypes on input   The options are         w    window size N     Merge variants at most this many bp apart  default 30       o    only variants     Don t output the entire haplotype  just concatenate                             REF ALT strings  delimited by             Vcfgeno2haplo  IS PART OF VCFLIB  ,vcfgeno2haplo,"vcf,fasta",VCFgenotype-to-haplotype:,vcf
792,Convert numerical representation of genotypes to allelic,,  Converts numerical representation of genotypes  standard in GT field  to the alleles provided in the call s ALT REF fields         Vcfgenotypes  IS PART OF VCFLIB  ,vcfgenotypes,vcf,VCFgenotypes:,tabular
793,"Count the number of heterozygotes and alleles, compute het/hom ratio",,  This tool performs three basic calculations     1  Computes the number of heterozygotes  2  Computes the ratio between heterozygotes and homozygotes  3  Computes the total number of alleles in the input dataset        This tools is based on vcfhetcount  vcfhethomratio and vcfcountalleles utilities from the VCFlib toolkit developed by Erik Garrison                                                                                                                                     ,vcfhethom,vcf,VCFhetHomAlleles:,tabular
794,Left-align indels and complex variants in VCF dataset,,  Left aligns variants in VCF dataset   Window size is determined dynamically according to the entropy of the regions flanking the indel   These must have entropy   1 bit bp  or be shorter than  5kb         Vcfleftalign  IS PART OF VCFLIB  ,vcfleftalign,"vcf,fasta",VCFleftAlign:,vcf
795,Extract flanking sequences for each VCF record,,  For each VCF record  extract the flanking sequences  and write them as FASTA records suitable for alignment   This tool is intended for use in designing validation experiments   Primers extracted which would flank all of the alleles at multi allelic sites   The name of the FASTA  reads  indicates the VCF record which they apply to  The form is  CHROM POS LEFT for the 3  primer and  CHROM POS RIGHT for the 5  primer  for example      20 233255 LEFT  CCATTGTATATATAGACCATAATTTCTTTATCCAATCATCTGTTGATGGA   20 233255 RIGHT  ACTCAGTTGATTCCATACCTTTGCCATCATGAATCATGTTGTAATAAACA        Vcfprimers  IS PART OF VCFLIB  ,vcfprimers,"vcf,fasta",VCFprimers:,fasta
796,Randomly sample sites from VCF dataset,, Randomly sample sites from an input VCF dataset  Scale the sampling probability by the field specified by   scale by  see advanced controls    This may be used to provide uniform sampling across allele frequencies  for instance  AF field in this case          Vcfrandomsample  IS PART OF VCFLIB      ,vcfrandomsample,vcf,VCFrandomSample:,vcf
