,description,edam_topics,help,id,inputs,name,outputs
319,align sequences to a profile HMM,,  HELP PRE   Perform a multiple sequence alignment of all the sequences in  seqfile  by aligning them individually to the profile HMM in  hmmfile   The new alignment is output to stdout in Stockholm format   The  hmmfile  should contain only a single profile  If it contains more  only the first profile in the file will be used   Either  hmmfile  or  seqfile   but not both  may be      dash   which means reading this input from stdin rather than a file   The sequences in  seqfile  are aligned in unihit local alignment mode  Therefore they should already be known to contain only a single domain  or a fragment of one   The optimal alignment may assign some residues as nonhomologous  N and C states   in which case these residues are still included in the resulting alignment  but shoved to the outer edges  To trim these unaligned nonhomologous residues from the result  see the   trim option     HELP PRE OTH    FORMAT SELECTOR HELP    ATTRIBUTION  ,hmmer_hmmalign,fasta,hmmalign,stockholm
320,Build a profile HMM from an input multiple alignment,,  HELP PRE   For each multiple sequence alignment in  msafile  build a profile HMM and save it to a new file  hmmfile out     HELP PRE OTH    FORMAT SELECTOR HELP   MCSS HELP   ARSWS HELP   AEEWS HELP   PRIOR HELP   HSSI HELP   EVAL CALIB HELP   SEED HELP   LENGTHS HELP    ATTRIBUTION  ,hmmer_hmmbuild,,hmmbuild,hmm3
321,convert profile file to a HMMER format,,  HELP PRE   The hmmconvert utility converts an input profile file to different HMMER formats   By default  the input profile can be in any HMMER format  including old obsolete formats from HMMER2  ASCII or binary  the output profile is a current HMMER3 ASCII format    ATTRIBUTION  ,hmmer_hmmconvert,,hmmconvert,hmm3
322,sample sequence(s) from a profile HMM,,Several output formats are available  each with different options ,hmmer_hmmemit,,hmmemit,fasta
323,retrieve profile HMM(s) from a file,,  HELP PRE   Quickly retrieves one or more profile HMMs from an  hmmfile   a large Pfam database  for example   The profile names should be listed in a text file  separated by newlines  By default  fetched HMMs are printed to standard output in HMMER3 format    ATTRIBUTION  ,hmmer_hmmfetch,"tabular,txt",hmmfetch,hmm3
324,search sequence(s) against a profile database,,  HELP PRE   hmmscan is used to search protein sequences against collections of protein profiles  For each sequence in  seqfile   use that query sequence to search the target database of profiles in  hmmfile   and output ranked lists of the profiles with the most significant matches to the sequence    HELP PRE OTH    OFORMAT WITH OPTS HELP   THRESHOLDS HELP   CUT HELP   ACCEL HEUR HELP   ADV OPTS HELP   SEED HELP    ATTRIBUTION  ,hmmer_hmmscan,fasta,hmmscan,txt
325,search profile(s) against a sequence database,,  HELP PRE   hmmsearch is used to search one or more profiles against a sequence database  For each profile in  hmmfile   use that query profile to search the target database of sequences in  seqdb   and output ranked lists of the sequences with the most significant matches to the profile  To build profiles from multiple alignments  see hmmbuild    HELP PRE OTH    OFORMAT WITH OPTS HELP   THRESHOLDS HELP   CUT HELP   ACCEL HEUR HELP   ADV OPTS HELP   SEED HELP    ATTRIBUTION  ,hmmer_hmmsearch,fasta,hmmsearch,txt
326,iteratively search a protein sequence against a protein database (PSIBLAST-like),,  HELP PRE   jackhmmer iteratively searches each query sequence in  seqfile  against the target sequence s  in  seqdb   The first iteration is identical to a phmmer search  For the next iteration  a multiple alignment of the query together with all target sequences satisfying inclusion thresholds is assembled  a profile is constructed from this alignment  identical to using hmmbuild on the alignment   and profile search of the  seqdb  is done  identical to an hmmsearch with the profile      HELP PRE OTH    OFORMAT WITH OPTS HELP NOPFAM   HSSI HELP   THRESHOLDS HELP   ACCEL HEUR HELP   MCSS HELP   ARSWS HELP   AEEWS HELP   PRIOR HELP   EVAL CALIB HELP   ADV OPTS HELP   SEED HELP    ATTRIBUTION  ,hmmer_jackhmmer,fasta,jackhmmer,txt
327,search a DNA model or alignment against a DNA database (BLASTN-like),,  HELP PRE   nhmmer is used to search one or more nucleotide queries against a nucleotide sequence database  For each query in  queryfile   use that query to search the target database of sequences in  seqdb   and output a ranked list of the hits with the most significant matches to the query  A query may be either a profile model built using hmmbuild  a sequence alignment  or a single sequence  Sequence based queries can be in a number of formats  see   qformat   and can typically be autodetected  Note that only Stockholm format supports the use of multiple sequence based queries    HELP PRE OTH    OFORMAT WITH OPTS N HELP   HSSI HELP   THRESHOLDS NODOM HELP   CUT HELP   ACCEL HEUR HELP   FORMAT SELECTOR HELP   ADV OPTS HELP   LENGTHS HELP   SEED HELP    ATTRIBUTION  ,hmmer_nhmmer,fasta,nhmmer,txt
328,search DNA sequence(s) against a DNA profile database,,  HELP PRE   nhmmscan is used to search nucleotide sequences against collections of nucleotide profiles  For each sequence in  seqfile   use that query sequence to search the target database of profiles in  hmmfile   and output ranked lists of the profiles with the most significant matches to the sequence   The  seqfile  may contain more than one query sequence  It can be in FASTA format  or several other common sequence file formats  genbank  embl  and uniprot  among others   or in alignment file formats  stockholm  aligned fasta  and others   See the   qformat option for a complete list    HELP PRE OTH    OFORMAT WITH OPTS N HELP   THRESHOLDS NODOM HELP   CUT HELP   ACCEL HEUR HELP   BIAS COMP HELP   ADV OPTS HELP   LENGTHS HELP   SEED HELP     ATTRIBUTION  ,hmmer_nhmmscan,fasta,nhmmscan,txt
329,search a protein sequence against a protein database (BLASTP-like),,  HELP PRE   phmmer is used to search one or more query protein sequences against a protein sequence database   For each query sequence in  seqfile   use that sequence to search the target database of sequences in  seqdb   and output ranked lists of the sequences with the most significant matches to the query     HELP PRE OTH    OFORMAT WITH OPTS HELP   HSSI HELP   THRESHOLDS HELP   ACCEL HEUR HELP   EVAL CALIB HELP   ADV OPTS HELP   SEED HELP    ATTRIBUTION  ,hmmer_phmmer,fasta,phmmer,txt
330, - Count aligned reads in a BAM file that overlap features in a GFF file,,The script outputs a table with counts for each feature  followed by the special counters  which count reads that were not counted for any feature for various reasons  namely,htseq_count,"sam,bam,gff,fasta",htseq-count,"tabular,bam"
331,to profile presence/absence and abundance of microbial pathways and gene families,,The input is a single file corresponding either to filtered shotgun sequencing metagenome file  fastq  fastq gz  fasta  or fasta gz format   alignment file  sam  bam or blastm8 format  or gene table file  tsv or biom format  HUMAnN creates three output files ,humann2,"fastq,fasta,sam,bam,biom1,tabular,txt,fasta,json,tsv",HUMAnN2,"tsv,biom1"
332,HUMAnN2 functions with metadata,,  HELP HEADER   When associating metadata with HUMAnN2 features  it is often beneficial to associate with community totals and avoid testing each individual feature stratification  to improve statistical power   This is the approach used by the HUMAnN2 utility script humann2 associate  which can compare feature totals across samples with 1  a single continuous metadatum  via the Spearman Correlation  or 2  a single categorical metadatum  via the Kruskal Wallis H test   Notably  this is a naive approach to association  but it is useful for tutorial purposes      ,humann2_associate,"tsv,tabular",Associate,tabular
333,stratified HUMAnN2 features,,  HELP HEADER   humann2 barplot produces plots of stratified HUMAnN2 features and includes many options for sorting and scaling data  Here is an example of a HUMAnN2 barplot for a pathway  denitrification  that was preferentially enriched in Human Microbiome Project oral samples relative to other body sites  This figure uses many options from humann2 barplot  including regrouping by genus  pseudolog scaling  and sorting samples by similarity and metadata      image    PATH TO IMAGES 731303924 page DENITRIFICATION PWY png     width  800     ,humann2_barplot,"tsv,tabular",Barplot,"png,pdf,svg"
334,,,  HELP HEADER   By default  the gene families and pathways output files from HUMAnN2 are species level  This tool generates genus level gene families     ,humann2_genefamilies_genus_level,"tsv,tabular",Create a genus level gene families file,tsv
335,HUMAnN2 generated tables,,  HELP HEADER   Join HUMAnN2 tables is a tool to join gene or pathway tables of multiple samples into a single table      ,humann2_join_tables,"tsv,tabular",Join,tsv
336,a HUMAnN2 generated table,,  HELP HEADER   Reduce HUMAnN2 table is a tool to reduce the table given a function  max  sum  mean or min       ,humann2_reduce_table,"tsv,tabular",Reduce,tsv
337,a HUMAnN2 generated table by features,,  HELP HEADER   Regroup HUMAnN2 table features is a tool for regrouping table features  abundances or coverage  given a table of feature values and a mapping of groups to component features  It produces a new table with group values in place of feature values      ,humann2_regroup_table,"tsv,tabular,tsv",Regroup,tsv
338,features of a HUMAnN2 generated table,,  HELP HEADER   Rename HUMAnN2 table features is a tool for renaming table features given a custom mapping  The mapping file must be tabular format file with two tab separated columns  The first column must contain the value you want to modify and the second contain the new valu     ,humann2_rename_table,"tsv,tabular,tsv",Rename,tsv
339,a HUMAnN2 generated table,,  HELP HEADER   Renorm HUMAnN2 table is a tool to renormalize a table  either in copies per million or in relative abundance  Each level of a stratified table will be normalized using the desired scheme       ,humann2_renorm_table,"tsv,tabular",Renormalize,tsv
340, combined meta'omic sequencing data,,  HELP HEADER   Given a DNA table and a RNA table  produce smoothed RNA and DNA values as well as relative expression values   Smoothing  means substituting a small value in place of a zero or missing value  The default method used is  Laplace   pseudocount  scaling  where the pseudocount is the sample specific minimum non zero value   Witten Bell smoothing is also implemented       ,humann2_rna_dna_norm,"tsv,tabular,biom1",Normalize,tsv
341,,,  HELP HEADER   This utility will split a table into two files  one stratified and one unstratified       ,humann2_split_stratified_table,"tsv,tabular,biom1",Split stratified table,tsv
342, a HUMAnN2 generated table,,  HELP HEADER   Split HUMAnN2 table is a tool to split a gene table with multiple columns  This file can have been generated with the join table tool      ,humann2_split_table,"tsv,tabular,biom1",Split,
343,,,  HELP HEADER   This script is currently at an experimental stage  Please use with caution   The HUMAnN2 script humann2 strain profiler can help explore strain level variation in your data  This approach assumes you have run HUMAnN2 on a series of samples and then merged the resulting genefamilies tsv tables with humann2 merge tables  Cases will arise in which the same species was detected in two or more samples  but gene families within that species were not consistently present across samples  For example  four samples may contain the species Dialister invisus  but only two samples contain the gene family UniRef50 Q5WII6 within Dialister invisus  This is a form of strain level variation in the Dialister invisus species  one which we can connect directly to function based on annotations of the UniRef50 Q5WII6 gene family   humann2 strain profiler first looks for  species  sample  pairs where  i  a large number of gene families within the species were identified  default  500  and  ii  the mean abundance of detected genes was high  default  mean   10 RPK   For species that meet these criteria  we can infer that absent gene families are likely to be truly absent  as opposed to undersampled  Simulations suggest that the cutoff of 10 RPK results in a false negative rate below 0 001  i e  for every 1000 genes identified as absent  at most one would be present but missed due to undersampling   For a given species  if at least two samples pass these criteria  the species and passing samples are sliced from the merged table and saved as a strain profile   Strain profiles can be additionally restricted to a subset of species  e g  those from a particular genus  or to gene families with a high level of variability in the population  e g  present in fewer than 80  of samples but more than 20  of samples   Additional thresholds  e g  the minimum non zero mean  can be configured with command line parameters      ,humann2_strain_profiler,"tsv,tabular,biom1",Make strain profiles,
344,,,  HELP HEADER   This utility will unpack the pathways to show the genes for each  It adds another level of stratification to the pathway abundance table by including the gene families  or EC  abundances      ,humann2_unpack_pathways,"tsv,tabular",Unpack pathway abundances to show genes included,tsv
345,compare ranked list of identifications,,  The  IDR       Irreproducible Discovery Rate  framework is a uni ed approach to measure the reproducibility of  ndings identi ed from replicate experiments and provide highly stable thresholds based on reproducibility  Unlike the usual scalar measures of reproducibility  the IDR approach creates a curve  which quantitatively assesses when the  ndings are no longer consistent across replicates       ,idr,"bed,gff",IDR,"bed,png"
346,Phylogenomic / evolutionary tree construction from multiple sequences,,IQ TREE takes as input a  multiple sequence alignment  and will reconstruct an evolutionary tree that is best explained by the input data  The input alignment can be in various common formats  For example the PHYLIP  format which may look like ,iqtree,"txt,nhx",IQ-TREE,"nhx,mldist,nex,iqtree"
347,Smooth and Plot,,The tool returns ,iwtomics_loadandplot,tabular,IWTomics Load,"rdata,tabular,pdf"
348,on Test Scale,,RData file with the IWTomicsData object with test results  tabular files with test IDs and feature IDs  These files are created by the tool  IWTomics Test and Plot  The tool returns ,iwtomics_plotwithscale,"rdata,tabular",IWTomics Plot with Threshold,"txt,pdf"
349,and Plot,,RData file with the IWTomicsData object  tabular files with region dataset IDs and feature IDs  These files are created by the tool  IWTomics Load Smooth and Plot  The tool returns ,iwtomics_testandplot,"rdata,tabular",IWTomics Test,"txt,pdf,rdata,tabular"
350,upgrades the bare data directory to a full JBrowse instance,, Upgrades an existing bare JBrowse  data  directory into a full fledged JBrowse instance    ATTRIBUTION  ,jbrowse_to_standalone,html,JBrowse - Data Directory to Standalone,html
351,genome browser,, JBrowse in Galaxy                    JBrowse in Galaxy offers a highly configurable  workflow compatible alternative to Trackster   Overview           JBrowse is a fast  embeddable genome browser built completely with JavaScript and HTML5   The JBrowse in Galaxy  JiG  tool was written to help build complex JBrowse installations straight from Galaxy  taking advantage of the latest Galaxy features such as dataset collections  sections  and colour pickers  It allows you to build up a JBrowse instance without worrying about how to run the command line tools to format your data  and which options need to be supplied and where  Additionally it comes with many javascript functions to handle colouring of features which would be nearly impossible to write without the assistance of this tool   The JBrowse in Galaxy tool is maintained by  Eric Rasche  mailto esr jig tamu edu      who you can contact if you encounter missing features or bugs   Options          The first option you encounter is the   Fasta Sequence s     This option now accepts multiple fasta files  allowing you to build JBrowse instances that contain data for multiple genomes or chrosomomes  generally known as  landmark features  in gff3 terminology   Up to 30 will be shown from the dropdown selector within JBrowse  this is a known issue     Standalone Instances   are a somewhat in development feature  Currently Galaxy copies the entire JBrowse directory in order to have a complete  downloadable file that contains a ready to go JBrowse instance  This is obviously an anti feature because users don t want a complete copy of JBrowse  6 20Mb  that s duplicated for every JBrowse dataset in their history  and admins don t want useless copies of JBrowse on disk  Unfortunately we have not come up with the perfect solution just yet  but we re working on it  In the meantime  users have been given the option to produce just the   data    directory  For those unfamiliar with JBrowse  the   data    directory contains processed data files  but no way to view them  This feature is additionally implemented for upcoming  Apollo      integration     Genetic Code   is a new feature in v0 4 of JiG   v1 12 0 of JBrowse  which allows users to specify a non standard genetic code  and have JBrowse highlight the correct start and stop codons  If you would like to use a coding table not provided by this list  please let  me  mailto esr jig tamu edu     know so that I may add support for this     Track Groups   represent a set of tracks in a single category  These can be used to let your users understand relationships between large groups of tracks      image   sections png  Annotation Tracks                    Within Track Groups  you have one or more   Annotation Tracks    Each Annotation Track is a groups of datasets which have similar styling  This allows you to rapidly build up JBrowse instances without having to configure tracks individually  A massive improvement over previous versions  For example  if you have five different GFF3 files from various gene callers that you wish to display  you can take advantage of this feature to style all of them similarly   There are a few different types of tracks supported  each with their own set of options   GFF3 BED GBK               These are your standard feature tracks  They usually highlight genes  mRNAs and other features of interest along a genomic region  The underlying tool and this help documentation focus primarily on GFF3 data  and have not been tested extensively with other formats  Automatic min max detection will likely fail under BED and GBK datasets   The data may be of a subclass we call   match match part   data  This consists of top level   match   features  with a child   match part   feature  and is often used in displaying alignments   See  Alignments  section on the  GFF3 specification      for more information   If the data is match match part  you will need to specify the top level match feature name  as it can be one of a few different SO terms  and JiG does not yet have the ability to understand SO terms   Next up is the   Styling Options   section  which lets you control a few properties on how the track is styled  Most of these you will not need to configure and can safely leave on defaults  Occasionally you will want to change what information is shown in the end product      image   styling png  In the above image you can see some black text  and some blue text  The source of the black text is configured with the   style label   option  and the source of the blue text is configured with the   style description   option   Feature Score Scaling   Colouring Options                                            First  you need to choose between ignoring the score attribute of GFF3 files  or using it  If you choose to ignore it  all features will be coloured with a solid colour  If you choose to use it  features will have slightly different colours based on their scores      image   opacity png  If you choose   Ignore score    you may choose between automatically choosing a colour  or manually specifying one  The automatically chosen colours vary along a brewer palette and generally look quite nice with no human intervention required  The manual colour choice is somewhat self explanatory  Clicking on the small coloured square will bring up a colour palette   If you choose   Base on score    you re faced with a dizzying array of options  First is the function to map the colour choices to colour values  JiG comes with a few functions built in such as linear scaling  logarithmic scaling  and blast scaling   The   linear scaling   method says  take these values  and they map directly to a range of output values     Logarithmic scaling   says  please take the log of the score before mapping   and   Blast scaling   is further specialised to handle blast data more nicely  These are convenience functions to help transform the wide array of possible values in the GFF3 score attribute to more meaningful numbers  If you need more comprehensive score scaling  it is recommended that you pre process your GFF3 files somehow   Once you ve selected a scaling method  you can choose to manually specify the minimum and maximum expected values  or you can let JiG determine them for you automatically   Finally  opacity is the only mapping we currently provide  Future iterations will attempt to improve upon this and provide more colour scales  The Opacity option maps the highest scoring features to full opacity  and everything else to lower ones   BAM Pileups              We support BAM files and can automatically generate SNP tracks based on that bam data      image   bam png  This is  strongly discouraged  for high coverage density datasets  Unfortunately there are no other configuration options exposed for bam files  If you find JBrowse options you wish to see exposed  please let  me  mailto esr jig tamu edu     know   BlastXML              image   blast png  JiG now supports both blastn and blastp datasets  JiG internally uses a blastXML to gapped GFF3 tool to convert your blastxml datasets into a format amenable to visualization in JBrowse  This tool is also available separately from the IUC on the toolshed     Minimum Gap Size   reflects how long a gap must be before it becomes a real gap in the processed gff3 file  In the picture above  various sizes of gaps can be seen  If the minimum gap size was set much higher  say 100nt  many of the smaller gaps would disappear  and the features on both sides would be merged into one  longer feature  This setting is inversely proportional to runtime and output file size   Do not set this to a low value for large datasets   By setting this number lower  you will have extremely large outputs and extremely long runtimes  The default was configured based off of the author s experience  but the author only works on small viruses  It is  strongly  recommended that you filter your blast results before display  e g  picking out the top 10 hits or so     Protein blast search   option merely informs underlying tools that they should adjust feature locations by 3x   Styling Options                  Please see the styling options for GFF3 datasets  they are identical   Feature Score Scaling   Coloring Options                                           Please see the score scaling and colouring options for GFF3 datasets  they are identical  Remember to set your score scaling to  blast  method if you do use it   Bigwig XY               image   bigwig png    XYPlot    BigWig tracks can be displayed as a  density  plot which is continuous line which varies in colour  or as an  XYplot   XYplots are preferable for users to visually identify specific features in a bigwig track  however density tracks are more visually compact     Variance Band   is an option available to XYPlots  and can be seen in the third and fourth tracks in the above picture  This overlays a mean line  and 1 and 2 standard deviation areas     Track Scaling   is different from colour scaling  instead it configures how the track behaves inside of JBrowse    Autoscaling globally   means that JBrowse will determine the minimum and maximum for the track  and fix the bounds of the viewport to that  E g  if your track ranges from 1 1000  and the region you re currently zoomed to only goes from 0 50  then the viewport range will still show 1 1000  This is good for global genomic context  However you may wish to consider   autoscaling locally   instead  In the example of a region which varies from 0 50  autoscaling locally would cause the individual track s viewport to re adjust and show just the 0 50 region  If neither of these options are palatable  you may manually hardcode the minimum and maximums for the track to scale to   Colour Options                 BigWig tracks have two colours in JBrowse  a positive and a negative colour   As always you may manually choose a colour  or let JiG choose for you   One of the more interesting options is the   Bicolor pivot    This option allows you to control the point at which JBrowse switches from the positive colour to the negative  In the above graphic  you can see this has been configured to  mean  for the first two  orange and blue  tracks   VCFs SNPs            These tracks do not support any special configuration   Known Issues                  More than 30 landmark features cannot be listed in the manual    selector     Non GFF3 likely has issue with automatically determined min max    scores  Manually specify minimum and maximum score attributes  or do    not use varied colours based on scores to avoid this issue     ATTRIBUTION  ,jbrowse,"fasta,html,gff3",JBrowse,html
