,description,edam_topics,help,id,inputs,name,outputs
555,from the given OBO ontology,,     class   infomark   Collects all the names of the relationship types in a given ontology     Example    If you ask for the relationships of the Gene Ontology  you will get      is a   part of   regulates   has part   negatively regulates   positively regulates      ,onto_tk_get_relationship_types,,Get all the relationship types,tabular
556,of a given OBO term,,     class   infomark  Collects the root terms  list of IDs  of the given OBO ontology       ,onto_tk_get_root_terms,,Get the root terms,tabular
557,from a given OBO term,,  Extracts a subontology  in OBO format  of a given ontology having as root node the provided term ID       ,onto_tk_get_subontology_from,,Get subontology,obo
558,of a given OBO ontology,,     class   infomark  Generates a flat file with two columns  TAB separated  with the term id and term definition from the elements of the given OBO ontology      Example    If you ask for the term IDs and terms definitions of the Gene Ontology  you will get      GO 0006285 The formation of an AP site  a deoxyribose sugar with a missing base  by DNA glycosylase which recognizes an altered base in DNA and catalyzes its hydrolytic removal  This sugar phosphate is the substrate recognized by the AP endonuclease  which cuts the DNA phosphodiester backbone at the 5  side of the altered site to leave a gap which is subsequently repaired    GO 0043527 A multimeric protein complex involved in the methylation of specific nucleotides in tRNA    GO 0005593 Any collagen polymer associated with collagen fibrils and in which the collagen monomers contain two or more relatively short triple helical domains connected by non triple helical sequences  the acronym FACIT stands for fibril associated collagen with interrupted triple helix    GO 0015777 The directed movement of teichoic acid into  out of  within or between cells by means of some external agent such as a transporter or pore  Teichoic acid is any polymer occurring in the cell wall  membrane or capsule of Gram positive bacteria and containing chains of glycerol phosphate or ribitol phosphate residues    GO 0047104 Catalysis of the reaction  NAD    CoA   palmitaldehyde   NADH   palmityl CoA    GO 0018302 The incorporation of iron into a 4Fe 4S iron sulfur cluster via tris L cysteinyl L N1  histidino tetrairon tetrasulfide                   ,onto_tk_term_id_vs_term_def,,Get all the term IDs and term definitions,tabular
559,of a given OBO ontology,,     class   infomark  Generates a flat file with two columns  TAB separated  with the term id and term name from the elements of the given OBO ontology      Example    If you ask for the term IDs and terms names of the Gene Ontology  you will get      GO 0050129 N formylglutamate deformylase activity   GO 0051663 oocyte nucleus localization involved in oocyte dorsal ventral axis specification   GO 0051712 positive regulation of killing of cells of another organism   GO 0033972 proclavaminate amidinohydrolase activity   GO 0032513 negative regulation of protein phosphatase type 2B activity   GO 0008711 ADP L glycero D manno heptose synthase activity   GO 0006285 base excision repair  AP site formation   GO 0043527 tRNA methyltransferase complex                  ,onto_tk_term_id_vs_term_name,,Get all the term IDs and term names,tabular
560,of a given OBO term,,     class   infomark  Collects the terms and there corresponding synonyms  list of IDs  of the given OBO ontology       ,onto_tk_get_term_synonyms,,Get all term synonyms,tabular
561,of a given OBO term,,     class   infomark  Collects the terms  list of IDs  of the given OBO ontology       ,onto_tk_get_terms,,Get all terms,tabular
562,by a concrete relationship type,,     class   infomark  Collects the terms that are related by a concrete relationship type  e g  is a     Example    If you ask for terms related by the relationship type  participates in  you will get tab delimited records like      PR 0000001 participates in GO 0000023   PR 0000002 participates in GO 0033224   PR 0000003 participates in GO 0021109   PR 0000004 participates in GO 0034099                    ,onto_tk_get_terms_by_relationship_type,,Get the terms that are related,tabular
563,,, This tool transforms an OBO formatted ontology  such as the Gene Ontology  to OWL       ,onto_tk_obo2owl,,Convert OBO to OWL,owl
564,,, This tool transforms an OBO formatted ontology  such as the Gene Ontology  to RDF XML       ,onto_tk_obo2rdf,,Convert OBO to RDF,rdf
565,of a given OBO ontology,,     class   infomark  Generates a flat file with two columns  TAB separated  with the term id and term definition from the elements of the given OBO ontology      Example    If you ask for the term IDs and terms definitions of the Gene Ontology  you will get      GO 0006285 The formation of an AP site  a deoxyribose sugar with a missing base  by DNA glycosylase which recognizes an altered base in DNA and catalyzes its hydrolytic removal  This sugar phosphate is the substrate recognized by the AP endonuclease  which cuts the DNA phosphodiester backbone at the 5  side of the altered site to leave a gap which is subsequently repaired    GO 0043527 A multimeric protein complex involved in the methylation of specific nucleotides in tRNA    GO 0005593 Any collagen polymer associated with collagen fibrils and in which the collagen monomers contain two or more relatively short triple helical domains connected by non triple helical sequences  the acronym FACIT stands for fibril associated collagen with interrupted triple helix    GO 0015777 The directed movement of teichoic acid into  out of  within or between cells by means of some external agent such as a transporter or pore  Teichoic acid is any polymer occurring in the cell wall  membrane or capsule of Gram positive bacteria and containing chains of glycerol phosphate or ribitol phosphate residues    GO 0047104 Catalysis of the reaction  NAD    CoA   palmitaldehyde   NADH   palmityl CoA    GO 0018302 The incorporation of iron into a 4Fe 4S iron sulfur cluster via tris L cysteinyl L N1  histidino tetrairon tetrasulfide                   ,onto_tk_term_id_vs_term_def,,Get all the term IDs and term definitions,tabular
566,finds orthogroups in a set of proteomes,,    ,orthofinder_onlygroups,"fasta,txt",OrthoFinder OnlyGroups,"txt,csv"
567,of insert size frequency,,Produces an insert size histogram and basic statistics for a paired end BAM file   Two outputs are produced ,pe_histogram,bam,Paired-end histogram,"png,tabular"
568,Paired-End read merger,,PEAR  is an ultrafast  memory efficient and highly accurate pair end read merger  PEAR evaluates all possible paired end read overlaps and without requiring the target fragment size as input  In addition  it implements a statistical test for minimizing false positive results  Together with a highly optimized implementation  it can merge millions of paired end reads within a couple of minutes on a standard desktop computer ,iuc_pear,"fastqillumina,fastqsanger",Pear,input
569,add comments to BAM dataset,,     class   infomark    Purpose    Adds one or more comments   CO  to the header of a specified BAM dataset    dataset collections    description     COMMENT String   C String          Comments to add to the BAM file  This option may be specified 0 or more times    more info    ,picard_AddCommentsToBam,bam,AddCommentsToBam,bam
570,add or replaces read group information,,  OUTPUT File   O File                  Output file  bam or sam    Required   SORT ORDER SortOrder   SO SortOrder            Optional sort order to output in  If not supplied OUTPUT is in the same order as INPUT                            Default value  null  Possible values   unsorted  queryname  coordinate ,picard_AddOrReplaceReadGroups,"bam,sam",AddOrReplaceReadGroups,bam
571,convert coordinate data into picard interval list format,,     class   infomark    Purpose    Convert coordinate data  such as BED or Galaxy Interval  into Picard Interval Format    dataset collections    description     SEQUENCE DICTIONARY File   SD File                       The sequence dictionary  You can either use dictionary pre cached                                 on this instance of Galaxy  or create one on teh fly from a FASTA                                 file uploaded to history  right pane of the interface      more info    ,picard_BedToIntervalList,"fasta,bed",BedToIntervalList,picard_interval_list
572,perform SAM/BAM grooming,,     class   infomark    Purpose    Read SAM BAM and perform various fix ups  Currently  the only fix ups are    1  to soft clip an alignment that hangs off the end of its reference sequence   2  to set MAPQ to 0 if a read is unmapped    dataset collections    more info     ,picard_CleanSam,"sam,bam",CleanSam,bam
573,writes a file containing summary alignment metrics,,     class   infomark    Purpose    Reads a SAM or BAM file and writes a file containing summary alignment metrics    dataset collections    description     MAX INSERT SIZE Integer       Paired end reads above this insert size will be considered chimeric along with                                 inter chromosomal pairs   Default value  100000     ADAPTER SEQUENCE String       List of adapter sequences to use when processing the alignment metrics  This option may                                 be specified 0 or more times     METRIC ACCUMULATION LEVEL MetricAccumulationLevel   LEVEL MetricAccumulationLevel The level s  at which to accumulate metrics     Possible values   ALL READS  SAMPLE                                  LIBRARY  READ GROUP  This option may be specified 0 or more times     IS BISULFITE SEQUENCED Boolean   BS Boolean                    Whether the SAM or BAM file consists of bisulfite sequenced reads      REFERENCE SEQUENCE File   R File                        Reference sequence fasta  Default value  null     ASSUME SORTED Boolean   AS Boolean                    If true  default   then the sort order in the header file will be ignored    more info     ,picard_CASM,"sam,bam,fasta",Collect Alignment Summary Metrics,tabular
574,charts the nucleotide distribution per cycle in a SAM or BAM dataset,,     class   infomark    Purpose    Program to chart the nucleotide distribution per cycle in a SAM or BAM file    dataset collections    description     ALIGNED READS ONLY Boolean    If set to true  calculate the base distribution over aligned reads only   Default value                                  false  This option can be set to  null  to clear the default value  Possible values                                   true  false     PF READS ONLY Boolean         If set to true calculate the base distribution over PF reads only   Default value  false                                  This option can be set to  null  to clear the default value  Possible values   true                                  false     REFERENCE SEQUENCE File   R File                        Reference sequence fasta  Default value  null     ASSUME SORTED Boolean   AS Boolean                    If true  default   then the sort order in the header file will be ignored   Default   more info     ,picard_CollectBaseDistributionByCycle,"sam,bam,fasta",CollectBaseDistributionByCycle,"tabular,pdf"
575,charts the GC bias metrics,,     class   infomark    Purpose    Program to chart the nucleotide distribution per cycle in a SAM or BAM file    dataset collections    description     ALIGNED READS ONLY Boolean    If set to true  calculate the base distribution over aligned reads only   Default value                                  false  Possible values   true  false     PF READS ONLY Boolean         If set to true calculate the base distribution over PF reads only   Default value  false                                  This option can be set to  null  to clear the default value  Possible values   true                                  false     ASSUME SORTED Boolean   AS Boolean                    If true  default   then the sort order in the header file will be ignored   Default  True   more info     ,picard_CollectGcBiasMetrics,"sam,bam,fasta",CollectGcBiasMetrics,"tabular,pdf"
576,plots distribution of insert sizes,,     class   infomark    Purpose    Reads a SAM or BAM dataset and writes a file containing metrics about the statistical distribution of insert size  excluding duplicates  and generates a Histogram plot    dataset collections    description      DEVIATIONS Double             Generate mean  sd and plots by trimming the data down to MEDIAN                                   DEVIATIONS MEDIAN ABSOLUTE DEVIATION  This is done because insert size data typically                                 includes enough anomalous values from chimeras and other artifacts to make the mean and                                 sd grossly misleading regarding the real distribution   Default value  10 0     HISTOGRAM WIDTH Integer   W Integer                     Explicitly sets the Histogram width  overriding automatic truncation of Histogram tail                                  Also  when calculating mean and standard deviation  only bins    Histogram WIDTH will be                                 included   Default value  not set     MINIMUM PCT Float   M Float                       When generating the Histogram  discard any data categories  out of FR  TANDEM  RF  that                                 have fewer than this percentage of overall reads   Range  0 to 1    Default value  0 05     METRIC ACCUMULATION LEVEL MetricAccumulationLevel   LEVEL MetricAccumulationLevel The level s  at which to accumulate metrics     Possible values   ALL READS  SAMPLE                                  LIBRARY  READ GROUP  This option may be specified 0 or more times     ASSUME SORTED Boolean   AS Boolean                    If true  default   then the sort order in the header file will be ignored   Default                                 value  true  This option can be set to  null  to clear the default value  Possible                                 values   true  false    more info     ,picard_CollectInsertSizeMetrics,"sam,bam,fasta",CollectInsertSizeMetrics,"tabular,pdf"
577, collect metrics about the alignment of RNA to various functional classes of loci in the genome,,     class   infomark    Purpose    Collects metrics about the alignment of RNA to various functional classes of loci in the genome  coding  intronic  UTR  intergenic  ribosomal    dataset collections             class   warningmark    Obtaining gene annotations in refFlat format    This tool requires gene annotations in refFlat  format  These data can be obtained from UCSC table browser directly through Galaxy by following these steps      1  Click on   Get Data   in the upper part of left pane of Galaxy interface    2  Click on   UCSC Main   link    3  Set your genome and dataset of interest  It   must   be the same genome build against which you have mapped the reads contained in the BAM file you are analyzing    4  In the   output format   field choose   selected fields from primary and related tables      5  Click   get output   button    6  In the first table presented at the top of the page select  using checkboxes  first 11 fields        name       chrom       strand       txStart       txEnd       cdsStart       cdsEnd       exonCount       exonStarts       exonEnds       proteinId    7  Click   done with selection      8  Click   Send query to Galaxy      9  A new dataset will appear in the current Galaxy history    10  Use this dataset as the input for   Gene annotations in refFlat form   dropdown of this tool      refFlat   format9   description      REF FLAT File                 Gene annotations in refFlat form   Format described here                                    format9  Required      RIBOSOMAL INTERVALS File      Location of rRNA sequences in genome  in interval list format   If not specified no bases                                  will be identified as being ribosomal  Format described here                                    and can be                                  generated from BED datasetes using Galaxy s wrapper for picard BedToIntervalList tool     STRAND SPECIFICITY StrandSpecificity    STRAND StrandSpecificity      For strand specific library prep  For unpaired reads  use FIRST READ TRANSCRIPTION STRAND                                  if the reads are expected to be on the transcription strand   Required  Possible values                                    NONE  FIRST READ TRANSCRIPTION STRAND  SECOND READ TRANSCRIPTION STRAND      MINIMUM LENGTH Integer        When calculating coverage based values  e g  CV of coverage  only use transcripts of this                                  length or greater   Default value  500      IGNORE SEQUENCE String        If a read maps to a sequence specified with this option  all the bases in the read are                                  counted as ignored bases      RRNA FRAGMENT PERCENTAGE Double                                  This percentage of the length of a fragment must overlap one of the ribosomal intervals                                  for a read or read pair by this must in order to be considered rRNA   Default value  0 8      METRIC ACCUMULATION LEVEL MetricAccumulationLevel    LEVEL MetricAccumulationLevel The level s  at which to accumulate metrics     Possible values   ALL READS  SAMPLE                                   LIBRARY  READ GROUP  This option may be specified 0 or more times      ASSUME SORTED Boolean    AS Boolean                    If true  default   then the sort order in the header file will be ignored   Default                                  value  true  Possible values   true  false    more info     ,picard_CollectRnaSeqMetrics,"sam,bam,fasta,gtf,gff3,tabular,picard_interval_list",CollectRnaSeqMetrics,"pdf,tabular"
578,compute metrics for evaluating of whole genome sequencing experiments,,     class   infomark    Purpose    Computes a number of metrics that are useful for evaluating coverage and performance of whole genome sequencing experiments    dataset collections    description     MINIMUM MAPPING QUALITY Integer   MQ Integer                    Minimum mapping quality for a read to contribute coverage   Default value  20     MINIMUM BASE QUALITY Integer   Q Integer                     Minimum base quality for a base to contribute coverage   Default value  20     COVERAGE CAP Integer   CAP Integer                   Treat bases with coverage exceeding this value as if they had coverage at this value                                  Default value  250    more info     ,picard_CollectWgsMetrics,"sam,bam,fasta",CollectWgsMetrics,tabular
579,Downsample a file to retain a subset of the reads,,     class   infomark    Purpose    Randomly down sample a SAM or BAM file to retain a random subset of the reads  Mate pairs are either both kept or both discarded  Reads marked as not primary alignments are all discarded  Each read is given a probability P of being retained   results with the exact same input in the same order and with the same value for RANDOM SEED will produce the same results    dataset collections    description     INPUT File   I File              The input SAM or BAM file to downsample   Required     OUTPUT File   O File              The output  downsampled  SAM or BAM file to write   Required     RANDOM SEED Long   R Long              Random seed to use if reproducibilty is desired   Setting to null will cause multiple                       invocations to produce different results     PROBABILITY Double   P Double            The probability of keeping any individual read  between 0 and 1      more info    ,picard_DownsampleSam,"sam,bam",Downsample SAM/BAM,bam
580,assess sequence library complexity from read sequences,,    Purpose    Attempts to estimate library complexity from sequence of read pairs alone  Does so by sorting all reads by the first N bases  5 by default  of each read and then comparing reads with the first N bases identical to each other for duplicates  Reads are considered to be duplicates if they match each other with no gaps and an overall mismatch rate less than or equal to MAX DIFF RATE  0 03 by default    Reads of poor quality are filtered out so as to provide a more accurate estimate  The filtering removes reads with any no calls in the first N bases or with a mean base quality lower than MIN MEAN QUALITY across either the first or second read   Unpaired reads are ignored in this computation  The algorithm attempts to detect optical duplicates separately from PCR duplicates and excludes these in the calculation of library size   Also  since there is no alignment to screen out technical reads one further filter is applied on the data  After examining all reads a Histogram is built of   reads in duplicate set     of duplicate sets   all bins that contain exactly one duplicate set are then removed from the Histogram as outliers before library size is estimated    dataset collections    description     MIN IDENTICAL BASES Integer   The minimum number of bases at the starts of reads that must be identical for reads to be                                 grouped together for duplicate detection   In effect total reads   4 max id bases reads                                 will be compared at a time  so lower numbers will produce more accurate results but                                 consume exponentially more memory and CPU   Default value  5     MAX DIFF RATE Double          The maximum rate of differences between two reads to call them identical   Default value                                  0 03     MIN MEAN QUALITY Integer      The minimum mean quality of the bases in a read pair for the read to be analyzed  Reads                                 with lower average quality are filtered out and not considered in any calculations                                  Default value  20     MAX GROUP RATIO Integer       Do not process self similar groups that are this many times over the mean expected group                                 size  I e  if the input contains 10m read pairs and MIN IDENTICAL BASES is set to 5  then                                 the mean expected group size would be approximately 10 reads   Default value  500     READ NAME REGEX String        Regular expression that can be used to parse read names in the incoming SAM file  Read                                 names are parsed to extract three variables  tile region  x coordinate and y coordinate                                  These values are used to estimate the rate of optical duplication in order to give a more                                 accurate estimated library size  Set this option to null to disable optical duplicate                                 detection  The regular expression should contain three capture groups for the three                                 variables  in order  It must match the entire read name  Note that if the default regex                                 is specified  a regex match is not actually done  but instead the read name  is split on                                 colon character  For 5 element names  the 3rd  4th and 5th elements are assumed to be                                 tile  x and y values  For 7 element names  CASAVA 1 8   the 5th  6th  and 7th elements                                 are assumed to be tile  x and y values   Default value                                   a zA Z0 9    0 9    0 9      0 9      0 9          OPTICAL DUPLICATE PIXEL DISTANCE Integer                                 The maximum offset between two duplicte clusters in order to consider them optical                                 duplicates  This should usually be set to some fairly small number  e g  5 10 pixels                                  unless using later versions of the Illumina pipeline that multiply pixel values by 10  in                                 which case 50 100 is more normal   Default value  100     more info     ,picard_EstimateLibraryComplexity,bam,EstimateLibraryComplexity,tabular
581,convert Fastq data into unaligned BAM,,  FASTQ2 File   F2 File                       Input fastq file for the second read of paired end data  if used    QUALITY FORMAT FastqQualityFormat   V FastqQualityFormat          A value describing how the quality values are encoded in the fastq   Either Solexa for                                 pre pipeline 1 3 style scores  solexa scaling   66   Illumina for pipeline 1 3 and above                                  phred scaling   64  or Standard for phred scaled scores with a character shift of 33                                  If this value is not specified  the quality format will be detected automatically                                  Default value  null  Possible values   Solexa  Illumina  Standard ,picard_FastqToSam,fastq,FastqToSam,bam
