,description,edam_topics,help,id,inputs,name,outputs
0,,,Given a FASTA contig file or a genbank file  ABRicate will perform a mass screening of contigs and identify the presence of antibiotic resistance genes  The user can choose which database to search from a list of available AMR databases ABRicate will produce a tab seperated output file with the following outputs   ,abricate,"fasta,genbank,embl",ABRicate,tabular
1,,,ABRicate List will list all the antibiotic databases used by ABRicate  The database of these genes is built from ResFinder      ,abricate_list,,ABRicate List,txt
2,de novo sequence assembler,, ABySS   is a de novo sequence assembler intended for short paired end reads and large genomes Input files should be FASTA or FASTQ files For paired reads  a pair of reads must be named with the suffixes  1 and  2 to identify the first and second read  or the reads may be named identically  The paired reads may be in separate files or interleaved in a single file ,abyss-pe,"fasta,fastq,fastqsanger,fastqillumina",ABySS,"fasta,tabular"
3,Linkage and Haplotype analysis,, Allegro is a computer program for multipoint genetic linkage analysis and related calculations  Allegro can do both classical parametric linkage analysis and analysis based on allele sharing models  In addition  Allegro estimates total number of recombinations between markers  computes posterior IBD sharing probabilities  re constructs haplotypes and does two types of simulation  Thus Allegro includes the basic functionality of the well known Genehunter program  Kruglyak et al  1996   It can analyse pedigrees of moderate size and it can handle many markers  The biggest advantages of Allegro over Genehunterar the allele sharing models that it provides and a much shorter execution time      ,allegro,"linkage_pedin,linkage_recomb,linkage_map,txt",Allegro,"allegro_haplo,allegro_linkage,allegro_descent,txt"
4,annotate a generic set of identifiers,,This tool can get annotation for a generic set of IDs  using the Bioconductor  annotation data packages  Supported organisms are human  mouse  fruit fly and zebrafish  The org db packages that are used here are primarily based on mapping using Entrez Gene identifiers  More information on the annotation packages can be found at the Bioconductor website  for example  information on the human annotation package  org Hs eg db  can be found here  A tab delimited file with identifiers in the first column  If the file contains a header row  select the file has a header option in the tool form above If the input IDs are Ensembl  the default output will be similar to below  containing four columns  Other columns  such as GO and KEGG terms  can be selected above to be added as additional columns         ALIAS    Commonly used gene symbols         DESCRIPTION    The description of the associated gene         EVIDENCE    Evidence codes for GO associations with a gene of interest         GENENAME    The full gene name         ONTOLOGY    For GO Identifiers  which Gene Ontology  BP  CC  or MF ,annotatemyids,tabular,annotateMyIDs,"tabular,txt"
5,simulates pyrosequencing data,, Art 454 Pyrosequencing Simulator                                   ART 454 is a simulation program to generate sequence read data of Roche 454 Pyrosequencing sequencers  ART generates reads according to the empirical read quality profile and the calibrated error profile of uncall overcall homopolymers from real 454 read data  ART has been using for testing or benchmarking a variety of method or tools for next generation sequencing data analysis  including read alignment  de novo assembly  detection of SNP  CNV  or other structure variation   art 454 can generate both single end and paired end of 454 sequencing platform  Besides for regular genome DNA and cDNA sequencing simulation  art 454 also supports amplicon sequencing  The reference sequences can be either DNA or RNA        ,art_454,fasta,ART 454,"fastq,sam,aln"
6,simulates sequencing data,, Art Illumina Simulator                         ART  art Illumina Q version  is a simulation program to generate sequence read data of Illumina sequencers  ART generates reads according to the empirical read quality profile summarized from large real read data  ART has been using for testing or benchmarking a variety of methods or tools for next generation sequencing data analysis  including read alignment  de novo assembly  detection of SNP  CNV  or other structure variation   art Illumina can generate single end  paired end   mate pair reads  and amplicon sequencing simulation of Illumina sequencing platform  Its outputs include FASTQ read  ALN and or SAM alignment files         ,art_illumina,fasta,ART Illumina,"fastq,sam,aln"
7,simulates SOLiD data,, Art SOLiD Simulator                      ART SOLiD  is a simulation program to generate sequence read data of SOLiD sequencing reads  ART generates reads according to a SOLiD read error profile  The built in error profile is an empiricial error profile summarized from large SOLiD sequencing data  ART has been using for testing or benchmarking a variety of method or tools for next generation sequencing data analysis  including read alignment  de novo assembly  detection of SNP  CNV  or other structure variation   art SOLiD can generate both single end  matepair  and paired end of SOLiD sequencing platform  art SOLiD also support amplicon sequencing simulation with RNA references        ,art_solid,fasta,ART SOLiD,"fastq,sam"
8,gene prediction for prokaryotic and eukaryotic genomes,,AUGUSTUS is a gene prediction program for prokaryotes and eukaryotes written by Mario Stanke and Oliver Keller  It can be used as an ab initio program  which means it bases its prediction purely on the sequence  AUGUSTUS may also incorporate hints on the gene structure coming from extrinsic sources such as EST  MS MS  protein alignments and synthenic genomic alignments Input data for the gene prediction tool Augustus is a FASTA file with a genomic nucleotide sequence    Output  Augustus produces three output files  a FASTA file with predicted coding sequences  a FASTA file with predicted protein sequences and a gtf GFF output file if selected ,augustus,"fasta,augustus",Augustus,"gtf,fasta"
9,ab-initio gene predictor,,         This tool allows to train Augustus  the ab initio gene predictor  based on a previous prediction  e g  made with Maker       ,augustus_training,"fasta,gff",Train Augustus,augustus
10,,,Converts BAM data to ScIdx  the Strand specific coordinate count format  which is used by tools within the Chip exo Galaxy flavor   ScIdx files are 1 based   The format consists of 5 columns  the chromosome  the position of the genomic coordinate  the number of tags on the forward strand  the number of tags on the reverse strand and the number of total tags on the position   With pair end reads  only the 5  end of READ1 will be used to create the ScIdx data file   Tools that use this format include GeneTrack and MultiGPS ,bam_to_scidx,bam,Convert BAM to ScIdx,scidx
11,Locate ribosomal RNA's in a fasta file. (GFF output),, Fasta file   The fasta file whose contents you want to search for ribosomal RNA s ,barrnap,fasta,barrnap,gff3
12,Detecting natural selection from population-based genetic data,,This program  BayeScan aims at identifying candidate loci under natural selection from genetic data  using differences in allele frequencies between populations BayeScan uses its own input file formats  which depend on the type of data used  All input files are simply in text format ,BayeScan,"tabular,txt",BayeScan,txt
13,Annotate and edit VCF/BCF files,,                                     bcftools  EXECUTABLE                                      Annotate and edit VCF BCF files   Examples         Remove three fields     bcftools annotate  x ID INFO DP FORMAT DP file vcf gz        Remove all INFO fields and all FORMAT fields except for GT and PL     bcftools annotate  x INFO  FORMAT GT FORMAT PL file vcf        Add ID  QUAL and INFO TAG  not replacing TAG if already present     bcftools annotate  a src bcf  c ID QUAL  TAG dst bcf        Carry over all INFO and FORMAT annotations except FORMAT GT     bcftools annotate  a src bcf  c INFO  FORMAT GT dst bcf        Annotate from a tab delimited file with six columns  the fifth is ignored         first indexing with tabix  The coordinates are 1 based      tabix  s1  b2  e2 annots tab gz     bcftools annotate  a annots tab gz  h annots hdr  c CHROM POS REF ALT   TAG file vcf        Annotate from a tab delimited file with regions  1 based coordinates  inclusive      tabix  s1  b2  e3 annots tab gz     bcftools annotate  a annots tab gz  h annots hdr  c CHROM FROM TO TAG inut vcf        Annotate from a bed file  0 based coordinates  half closed  half open intervals      bcftools annotate  a annots bed gz  h annots hdr  c CHROM FROM TO TAG input vcf   REGIONS HELP   EXPRESSIONS HELP    BCFTOOLS MANPAGE   EXECUTABLE    BCFTOOLS WIKI       ,bcftools_@EXECUTABLE@,"vcf,tabular,bed,txt,tabular",bcftools @EXECUTABLE@,
14,SNP/indel variant calling from VCF/BCF,,                                     bcftools  EXECUTABLE                                      SNP indel variant calling from VCF BCF  To be used in conjunction with samtools mpileup        This command replaces the former  bcftools view  caller       Some of the original functionality has been temporarily lost in the process of transition to htslib  but will be added back on popular demand       The original calling model can be invoked with the  c option   The novel rate option can be set to modify the likelihood of novel mutation for constrained  C trio calling  The trio genotype calling maximizes likelihood of a particular combination of genotypes for father  mother and the child P F i M j C k    P unconstrained    Pn   P constrained     1 Pn   By providing three values  the mutation rate Pn is set explicitly for SNPs  deletions and insertions  respectively  If two values are given  the first is interpreted as the mutation rate of SNPs and the second is used to calculate the mutation rate of indels according to their length as Pn float exp  a b len   where a 22 8689  b 0 2994 for insertions and a 21 9313  b 0 2856 for deletions  pubmed 23975140   If only one value is given  the same mutation rate Pn is used for SNPs and indels      REGIONS HELP   TARGETS HELP    BCFTOOLS MANPAGE   EXECUTABLE    BCFTOOLS WIKI       ,bcftools_@EXECUTABLE@,tabular,bcftools @EXECUTABLE@,
15,"Copy number variation caller, requires Illumina's B-allele frequency (BAF) and Log R Ratio intensity (LRR)",,                                        bcftools  EXECUTABLE                                         Copy number variation caller  requires Illumina s B allele frequency  BAF  and Log R Ratio intensity  LRR    The HMM considers the following copy number states  CN 2  normal   1  single copy loss   0  complete loss   3  single copy gain    REGIONS HELP   TARGETS HELP    BCFTOOLS MANPAGE   EXECUTABLE    BCFTOOLS WIKI       ,bcftools_@EXECUTABLE@,fasta,bcftools @EXECUTABLE@,tabular
16,Concatenate or combine VCF/BCF files,,                                        bcftools  EXECUTABLE  plugin                                        Concatenate or combine VCF BCF files  All source files must have the same sample columns appearing in the same order  The program can be used  for example  to concatenate chromosome VCFs into one VCF  or combine a SNP VCF and an indel VCF into one  The input files must be sorted by chr and position  The files must be given in the correct order to produce sorted VCF on output unless the  a    allow overlaps option is specified    Naive concatenation is useful when using a galaxy workflow that splits a BAM file by chromosome  processes each in parallel  then bcftools concat merges the results into a single VCF file    BAM    bamtools split    bcftools mpileup    bcftools call    bcftools concat    VCF    REGIONS HELP    BCFTOOLS MANPAGE   EXECUTABLE    BCFTOOLS WIKI       ,bcftools_@EXECUTABLE@,,bcftools @EXECUTABLE@,
17,Create consensus sequence by applying VCF variants to a reference fasta file,,                                        bcftools  EXECUTABLE  plugin                                         Create consensus sequence by applying VCF variants to a reference fasta file    BCFTOOLS MANPAGE   EXECUTABLE    BCFTOOLS WIKI       ,bcftools_@EXECUTABLE@,tabular,bcftools @EXECUTABLE@,"fasta,txt"
18,Converts VCF/BCF to IMPUTE2/SHAPEIT formats,,                                        bcftools  EXECUTABLE  from vcf                                        Converts VCF BCF to other formats  See man page for file formats details     REGIONS HELP   TARGETS HELP   EXPRESSIONS HELP    BCFTOOLS MANPAGE   EXECUTABLE    BCFTOOLS WIKI       ,bcftools_@EXECUTABLE@_from_vcf,,bcftools @EXECUTABLE@ from vcf,tabular
19,Converts other formats to VCF/BCFk,,                                        bcftools  EXECUTABLE  plugin                                        Converts other variant formats to vcf   See man page for file formats details    BCFTOOLS MANPAGE   EXECUTABLE    BCFTOOLS WIKI       ,bcftools_@EXECUTABLE@_to_vcf,"tabular,gvcf",bcftools @EXECUTABLE@ to vcf,
20,Haplotype aware consequence predictor,,                                        bcftools  EXECUTABLE                                         Haplotype aware consequence predictor which correctly handles combined variants such as MNPs split over multiple VCF records  SNPs separated by an intron  but adjacent in the spliced transcript  or nearby frame shifting indels which in combination in fact are not frame shifting   The output VCF is annotated with INFO BCSQ and FORMAT BCSQ tag  configurable with the  c option   The latter is a bitmask of indexes to INFO BCSQ  with interleaved haplotypes  See the usage examples below for using the  TBCSQ converter in query for extracting a more human readable form from this bitmask  The contruction of the bitmask limits the number of consequences that can be referenced in the FORMAT BCSQ tags  By default this is 16  but if more are required  see the   ncsq option   The program requires on input a VCF BCF file  the reference genome in fasta format    fasta ref  and genomic features in the GFF3 format downloadable from the Ensembl website    gff annot   and outputs an annotated VCF BCF file  Currently  only Ensembl GFF3 files are supported   By default  the input VCF should be phased  If phase is unknown  or only partially known  the   phase option can be used to indicate how to handle unphased data  Alternatively  haplotype aware calling can be turned off with the   local csq option   If conflicting  overlapping  variants within one haplotype are detected  a warning will be emitted and predictions will be based on only the first variant in the analysis   Symbolic alleles are not supported  They will remain unannotated in the output VCF and are ignored for the prediction analysis     REGIONS HELP   TARGETS HELP    BCFTOOLS MANPAGE   EXECUTABLE    BCFTOOLS WIKI       ,bcftools_@EXECUTABLE@,gff3,bcftools @EXECUTABLE@,
21,Apply fixed-threshold filters,,                                        bcftools  EXECUTABLE                                         Apply fixed threshold filters    REGIONS HELP   TARGETS HELP   EXPRESSIONS HELP     BCFTOOLS MANPAGE   EXECUTABLE    BCFTOOLS WIKI       ,bcftools_@EXECUTABLE@,,bcftools @EXECUTABLE@,
22,Check sample identity,,                                        bcftools  EXECUTABLE                                         Check sample identity  With no  g BCF given  multi sample cross check is performed    REGIONS HELP   TARGETS HELP    BCFTOOLS MANPAGE   EXECUTABLE    BCFTOOLS WIKI        ,bcftools_@EXECUTABLE@,"vcf,bcf",bcftools @EXECUTABLE@,tabular
23,"Create intersections, unions and complements of VCF files",,                                        bcftools  EXECUTABLE                                         Create intersections  unions and complements of VCF files    COLLAPSE HELP   REGIONS HELP   TARGETS HELP   EXPRESSIONS HELP    BCFTOOLS MANPAGE   EXECUTABLE    BCFTOOLS WIKI       ,bcftools_@EXECUTABLE@,,bcftools @EXECUTABLE@,
24,Merge multiple VCF/BCF files from non-overlapping sample sets to create one multi-sample file,,                                        bcftools  EXECUTABLE                                          Merge multiple VCF BCF files from non overlapping sample sets to create one multi sample file    Note that only records from different files can be merged  never from the same file   For  vertical  merge take a look at  bcftools norm  instead    REGIONS HELP    BCFTOOLS MANPAGE   EXECUTABLE    BCFTOOLS WIKI       ,bcftools_@EXECUTABLE@,vcf,bcftools @EXECUTABLE@,
25,Generate VCF or BCF containing genotype likelihoods for one or multiple alignment (BAM or CRAM) files,,                                        bcftools  EXECUTABLE                                         Haplotype aware consequence predictor which correctly handles combined variants such as MNPs split over multiple VCF records  SNPs separated by an intron  but adjacent in the spliced transcript  or nearby frame shifting indels which in combination in fact are not frame shifting   The output VCF is annotated with INFO BCSQ and FORMAT BCSQ tag  configurable with the  c option   The latter is a bitmask of indexes to INFO BCSQ  with interleaved haplotypes  See the usage examples below for using the  TBCSQ converter in query for extracting a more human readable form from this bitmask  The contruction of the bitmask limits the number of consequences that can be referenced in the FORMAT BCSQ tags  By default this is 16  but if more are required  see the   ncsq option   The program requires on input a VCF BCF file  the reference genome in fasta format    fasta ref  and genomic features in the GFF3 format downloadable from the Ensembl website    gff annot   and outputs an annotated VCF BCF file  Currently  only Ensembl GFF3 files are supported   By default  the input VCF should be phased  If phase is unknown  or only partially known  the   phase option can be used to indicate how to handle unphased data  Alternatively  haplotype aware calling can be turned off with the   local csq option   If conflicting  overlapping  variants within one haplotype are detected  a warning will be emitted and predictions will be based on only the first variant in the analysis   Symbolic alleles are not supported  They will remain unannotated in the output VCF and are ignored for the prediction analysis     REGIONS HELP   TARGETS HELP    BCFTOOLS MANPAGE   EXECUTABLE    BCFTOOLS WIKI       ,bcftools_@EXECUTABLE@,"bam,cram,fasta,txt",bcftools @EXECUTABLE@,
26,Left-align and normalize indels; check if REF alleles match the reference; split multiallelic sites into multiple rows; recover multiallelics from multiple rows,,                                        bcftools  EXECUTABLE                                          Left align and normalize indels  check if REF alleles match the reference  split multiallelic sites into multiple rows  recover multiallelics from multiple rows    REGIONS HELP   TARGETS HELP    BCFTOOLS MANPAGE   EXECUTABLE    BCFTOOLS WIKI       ,bcftools_@EXECUTABLE@,,bcftools @EXECUTABLE@,
27,"plugin Color shared chromosomal segments, requires phased GTs",,                                        bcftools  EXECUTABLE  plugin                                         REGIONS HELP   TARGETS HELP   EXPRESSIONS HELP    ,bcftools_plugin_@PLUGIN_ID@,,bcftools @EXECUTABLE@,svg
28,"plugin  counts number of samples, SNPs, INDELs, MNPs and total sites",,                                        bcftools  EXECUTABLE  plugin                                        Counts number of samples  SNPs  INDELs  MNPs and total number of sites    REGIONS HELP   TARGETS HELP   EXPRESSIONS HELP         ,bcftools_plugin_@PLUGIN_ID@,,bcftools @EXECUTABLE@,tabular
29,plugin genotype dosage,,                                        bcftools  EXECUTABLE  plugin                                         REGIONS HELP   TARGETS HELP   EXPRESSIONS HELP       ,bcftools_plugin_@PLUGIN_ID@,,bcftools @EXECUTABLE@,tabular
30,plugin Fill INFO fields AN and AC,,                                        bcftools  EXECUTABLE  plugin                                         REGIONS HELP   TARGETS HELP   EXPRESSIONS HELP       ,bcftools_plugin_@PLUGIN_ID@,,bcftools @EXECUTABLE@,
31,"plugin Set INFO tags AF, AN, AC, AC_Hom, AC_Het, AC_Hemi",,                                        bcftools  EXECUTABLE  plugin                                         REGIONS HELP   TARGETS HELP   EXPRESSIONS HELP       ,bcftools_plugin_@PLUGIN_ID@,,bcftools @EXECUTABLE@,
32,plugin  Fix ploidy,,                                        bcftools  EXECUTABLE  plugin                                         REGIONS HELP   TARGETS HELP   EXPRESSIONS HELP       ,bcftools_plugin_@PLUGIN_ID@,tabular,bcftools @EXECUTABLE@,
33,plugin Annotate frameshift indels,,                                        bcftools  EXECUTABLE  plugin                                         REGIONS HELP   TARGETS HELP   EXPRESSIONS HELP       ,bcftools_plugin_@PLUGIN_ID@,bed,bcftools @EXECUTABLE@,
34,plugin Add imputation information metrics to the INFO field,,                                        bcftools  EXECUTABLE  plugin                                         REGIONS HELP   TARGETS HELP   EXPRESSIONS HELP       ,bcftools_plugin_@PLUGIN_ID@,,bcftools @EXECUTABLE@,
35,plugin Count Mendelian consistent / inconsistent genotypes,,                                        bcftools  EXECUTABLE  plugin                                         REGIONS HELP   TARGETS HELP   EXPRESSIONS HELP       ,bcftools_plugin_@PLUGIN_ID@,txt,bcftools @EXECUTABLE@,
36,plugin Set missing genotypes,,                                        bcftools  EXECUTABLE  plugin                                         REGIONS HELP   TARGETS HELP   EXPRESSIONS HELP       ,bcftools_plugin_@PLUGIN_ID@,,bcftools @EXECUTABLE@,
37,plugin Sets genotypes,,                                        bcftools  EXECUTABLE  plugin                                         REGIONS HELP   TARGETS HELP   EXPRESSIONS HELP       ,bcftools_plugin_@PLUGIN_ID@,,bcftools @EXECUTABLE@,
38,"plugin Convert between similar tags, such as GL and GP",,                                        bcftools  EXECUTABLE  plugin                                         REGIONS HELP   TARGETS HELP   EXPRESSIONS HELP       ,bcftools_plugin_@PLUGIN_ID@,,bcftools @EXECUTABLE@,
39,Extracts fields from VCF/BCF file and prints them in user-defined format,,                                         bcftools  EXECUTABLE                                         Extracts fields from VCF BCF file and prints them in user defined format    Format                CHROM            The CHROM column  similarly also other columns  POS  ID  REF  ALT  QUAL  FILTER         INFO TAG         Any tag in the INFO column        TYPE             Variant type  REF  SNP  MNP  INDEL  OTHER         MASK             Indicates presence of the site in other files  with multiple files         TAG INT          Curly brackets to subscript vectors  0 based         FIRST ALT        Alias for  ALT 0                          The brackets loop over all samples        GT               Genotype  e g  0 1         TBCSQ            Translated FORMAT BCSQ  See the csq command above for explanation and examples         TGT              Translated genotype  e g  C A         IUPACGT          Genotype translated to IUPAC ambiguity codes  e g  M instead of C A         LINE             Prints the whole line        SAMPLE           Sample name        POS0             POS in 0 based coordinates        END              End position of the REF allele        END0             End position of the REF allele in 0 based cordinates        n                new line        t                tab character     Examples               Print chromosome  position  ref allele and the first alternate allele     bcftools query  f   CHROM   POS   REF   ALT 0  n  file vcf gz        Similar to above  but use tabs instead of spaces  add sample name and genotype     bcftools query  f   CHROM t POS t REF t ALT  t SAMPLE  GT  n  file vcf gz        Print FORMAT GT fields followed by FORMAT GT fields     bcftools query  f  GQ    GQ   t GT    GT  n  file vcf        Make a BED file  chr  pos  0 based   end pos  1 based   id     bcftools query  f  CHROM t POS0 t END t ID n  file bcf    COLLAPSE HELP   REGIONS HELP   TARGETS HELP   EXPRESSIONS HELP    BCFTOOLS MANPAGE   EXECUTABLE    BCFTOOLS WIKI       ,bcftools_@EXECUTABLE@,,bcftools @EXECUTABLE@,txt
40,in VCF/BCF file,,                                        bcftools List Samples  EXECUTABLE                                         Lists Samples from a VCF BCF file   BCFTOOLS MANPAGE   EXECUTABLE    BCFTOOLS WIKI       ,bcftools_@EXECUTABLE@_list_samples,,bcftools List Samples,tabular
41,"Modify header of VCF/BCF files, change sample names",,                                         bcftools  EXECUTABLE                                         Modify header of VCF BCF files  change sample names    BCFTOOLS MANPAGE   EXECUTABLE    BCFTOOLS WIKI       ,bcftools_@EXECUTABLE@,"vcf,tabular",bcftools @EXECUTABLE@,
42,HMM model for detecting runs of homo/autozygosity,,                                        bcftools  EXECUTABLE                                         HMM model for detecting runs of autozygosity    REGIONS HELP   TARGETS HELP    BCFTOOLS MANPAGE   EXECUTABLE    BCFTOOLS WIKI      ,bcftools_@EXECUTABLE@,data,bcftools @EXECUTABLE@,tabular
